{
  "schema_version": "1.0.0",
  "image_id": "3/84.png",
  "is_background": false,
  "label_status": "pending",
  "labeled_at": null,
  "labeled_by": null,
  "notes": null,
  "persons": [
    {
      "person_index": 1,
      "person_bbox": [
        0.0,
        106.4,
        704.3,
        1084.4
      ],
      "person_confidence": 0.9399,
      "patient_id_gt": null,
      "notes": null
    },
    {
      "person_index": 2,
      "person_bbox": [
        645.5,
        58.1,
        1116.6,
        1086.0
      ],
      "person_confidence": 0.8526,
      "patient_id_gt": null,
      "notes": null
    },
    {
      "person_index": 3,
      "person_bbox": [
        666.1,
        80.5,
        1446.6,
        1085.8
      ],
      "person_confidence": 0.8339,
      "patient_id_gt": null,
      "notes": null
    },
    {
      "person_index": 4,
      "person_bbox": [
        320.0,
        114.9,
        723.7,
        1085.5
      ],
      "person_confidence": 0.7797,
      "patient_id_gt": null,
      "notes": null
    },
    {
      "person_index": 5,
      "person_bbox": [
        616.0,
        315.8,
        746.6,
        479.3
      ],
      "person_confidence": 0.6938,
      "patient_id_gt": null,
      "notes": null
    },
    {
      "person_index": 6,
      "person_bbox": [
        1343.0,
        293.2,
        1410.4,
        405.1
      ],
      "person_confidence": 0.595,
      "patient_id_gt": null,
      "notes": null
    },
    {
      "person_index": 7,
      "person_bbox": [
        0.0,
        328.2,
        82.1,
        681.4
      ],
      "person_confidence": 0.5296,
      "patient_id_gt": null,
      "notes": null
    },
    {
      "person_index": 8,
      "person_bbox": [
        1393.8,
        323.9,
        1447.6,
        555.7
      ],
      "person_confidence": 0.4228,
      "patient_id_gt": null,
      "notes": null
    },
    {
      "person_index": 9,
      "person_bbox": [
        1392.2,
        309.3,
        1447.7,
        907.2
      ],
      "person_confidence": 0.362,
      "patient_id_gt": null,
      "notes": null
    }
  ]
}