{
  "schema_version": "1.0.0",
  "image_id": "FOLDER/FILENAME.png",
  "is_background": false,
  "label_status": "pending",
  "labeled_at": null,
  "labeled_by": null,
  "notes": null,
  "persons": [
    {
      "person_index": 1,
      "person_bbox": [0, 0, 0, 0],
      "person_confidence": null,
      "patient_id_gt": null,
      "notes": null
    }
  ]
}
